Timestamp,Title,Journal,Publication Year,Authors,Field,Link
,Difference in the Priestley-Taylor coefficients at two different heights of a tall micrometeorological tower,Agricultural and Forest Meteorology,2013,"Cho, J., Kim, W., Miyazaki, S., Komori, D., Kim, H., Han, K.-S., Kanae, S., Oki, T.",6.424,https://www.scopus.com/inward/record.uri?eid=2-s2.0-84879542032&doi=10.1016%2fj.agrformet.2013.05.007&partnerID=40&md5=aabb8e0fcd08bdcfa105ed537b327dc3
,Global flood risk under climate change,Nature Climate Change,2013,"Hirabayashi, Y., Mahendran, R., Koirala, S., Konoshima, L., Yamazaki, D., Watanabe, S., Kim, H., Kanae, S.",28.862,https://www.scopus.com/inward/record.uri?eid=2-s2.0-84883343408&doi=10.1038%2fnclimate1911&partnerID=40&md5=f84d6ac541a8a27db6667f74f7033440
,Analysis of the water level dynamics simulated by a global river model: A case study in the Amazon River,Water Resources Research,2012,"Yamazaki, D., Lee, H., Alsdorf, D.E., Dutra, E., Kim, H., Kanae, S., Oki, T.",6.159,https://www.scopus.com/inward/record.uri?eid=2-s2.0-84866233541&doi=10.1029%2f2012WR011869&partnerID=40&md5=2f9f7aa0659a60693d0b51a023a6f819
,Incorporating anthropogenic water regulation modules into a land surface model,Journal of Hydrometeorology,2012,"Pokhrel, Y., Hanasaki, N., Koirala, S., Cho, J., Yeh, P.J.F., Kim, H., Kanae, S., Oki, T.",4.871,https://www.scopus.com/inward/record.uri?eid=2-s2.0-84863338049&doi=10.1175%2fJHM-D-11-013.1&partnerID=40&md5=cce7f8278f7ead09c948e46a80e5bcf8
,Validation of gravity recovery and climate experiment data for assessment of terrestrial water storage variations,Multiscale Hydrologic Remote Sensing: Perspectives and Applications,2012,"Yeh, P.J.-F., Tang, Q., Kim, H.",,https://www.scopus.com/inward/record.uri?eid=2-s2.0-85055391420&doi=10.1201%2fb11279&partnerID=40&md5=d45fa2ac47c8896114c526b94dd74786
,Toward global-scale data assimilation using SWOT: Requirements for global hydrodynamics models,International Geoscience and Remote Sensing Symposium (IGARSS),2011,"Yamazaki, D., Alsdorf, D., Kim, H., Kanae, S., Oki, T., Andreadis, K.",0.5,https://www.scopus.com/inward/record.uri?eid=2-s2.0-80955139466&doi=10.1109%2fIGARSS.2011.6049855&partnerID=40&md5=35a2385f1b75791b569b74b7f886c5c9
,A physically based description of floodplain inundation dynamics in a global river routing model,Water Resources Research,2011,"Yamazaki, D., Kanae, S., Kim, H., Oki, T.",6.159,https://www.scopus.com/inward/record.uri?eid=2-s2.0-79953724402&doi=10.1029%2f2010WR009726&partnerID=40&md5=ce77bde9351ed9c35665f088bc4af1e9
,Estimating monthly total nitrogen concentration in streams by using artificial neural network,Journal of Environmental Management,2011,"He, B., Oki, T., Sun, F., Komori, D., Kanae, S., Wang, Y., Kim, H., Yamazaki, D.",8.91,https://www.scopus.com/inward/record.uri?eid=2-s2.0-77957769268&doi=10.1016%2fj.jenvman.2010.09.014&partnerID=40&md5=1dc5fe5b2e8f698aa35e903302bf52d5
,Movement of Amazon surface water from time-variable satellite gravity measurements and implications for water cycle parameters in land surface models,"Geochemistry, Geophysics, Geosystems",2010,"Han, S.-C., Yeo, I.-Y., Alsdorf, D., Bates, P., Boy, J.-P., Kim, H., Oki, T., Rodell, M.",4.48,https://www.scopus.com/inward/record.uri?eid=2-s2.0-77957593129&doi=10.1029%2f2010GC003214&partnerID=40&md5=e7f1cb5746893067ec9e9ffb10a8d148
,A study on the relationship between Atlantic sea surface temperature and Amazonian greenness,Ecological Informatics,2010,"Cho, J., Yeh, P.J.-F., Lee, Y.-W., Kim, H., Oki, T., Kanae, S., Kim, W., Otsuki, K.",4.498,https://www.scopus.com/inward/record.uri?eid=2-s2.0-77956819071&doi=10.1016%2fj.ecoinf.2010.05.005&partnerID=40&md5=ed28d40b0e422ecaacdaf7024b0808dd
,Role of rivers in the seasonal variations of terrestrial water storage over global basins,Geophysical Research Letters,2009,"Kim, H., Yeh, P.J.-F., Oki, T., Kanae, S.",5.576,https://www.scopus.com/inward/record.uri?eid=2-s2.0-71949105696&doi=10.1029%2f2009GL039006&partnerID=40&md5=19a9041de88ae14fd771d075d319acd4
,Dynamics of surface water storage in the Amazon inferred from measurements of inter-satellite distance change,Geophysical Research Letters,2009,"Han, S.-C., Kim, H., Yeo, I.-Y., Yeh, P., Oki, T., Seo, K.-W., Alsdorf, D., Luthcke, S.B.",5.576,https://www.scopus.com/inward/record.uri?eid=2-s2.0-68249144390&doi=10.1029%2f2009GL037910&partnerID=40&md5=1080724d2e36f30a1bd8fe7a93c37f33